{
  "ir_version": 1,
  "_source": {
    "project": {
      "project_id": 1,
      "app_title": "Base Simple",
      "date_format": "31 December 2026",
      "time_format": "11:59 PM",
      "language_select": "English",
      "timezone_select": "Asia/Kuala_Lumpur",
      "theme_select": "bootstrap",
      "use_3d_effects": 0,
      "rtl": 0,
      "compact": 1,
      "menu_orientation": "top",
      "menu_at_homepage": 1,
      "tables_per_row": 4,
      "extra_wide": 1,
      "panel_height": 100,
      "hide_login": 0,
      "allow_sql_tool": 1,
      "allow_server_status": 0,
      "admins_group_access": 1,
      "allow_table_view_sql": 0,
      "copy_children_async": 1,
      "allow_pwa_install": 1,
      "url": null,
      "project_hook_workflow": "{\n  \"blocks\": {\n    \"block_1770304262478\": {\n      \"type\": \"hook_trigger\",\n      \"x\": 132.6666259765625,\n      \"y\": 69.33331298828125\n    },\n    \"block_1770304280942\": {\n      \"type\": \"insert_record\",\n      \"x\": 90,\n      \"y\": 240,\n      \"configData\": \"[{\\\"type\\\":\\\"comment\\\",\\\"value\\\":\\\"\\\"}]\"\n    }\n  },\n  \"connections\": [\n    {\n      \"fromBlock\": \"block_1770304262478\",\n      \"fromPoint\": \"out\",\n      \"toBlock\": \"block_1770304280942\",\n      \"toPoint\": \"in\"\n    }\n  ]\n}",
      "stack_base": "laravel_filament",
      "stack_database": "sqlite",
      "stack_theme": "fixzySys",
      "data_delete_type": "soft",
      "module_auth_email": 1,
      "module_auth_email_2fa": 0,
      "module_auth_email_captcha": 0,
      "module_auth_ldap": 0,
      "module_auth_google_sso": 0,
      "module_authorization": 1,
      "module_log_audit": 1,
      "module_fake_data": 1,
      "tenancy_type": "standard",
      "tenant_table": "",
      "is_active": 1
    },
    "database": {
      "name": "base_simple",
      "table": {
        "users": {
          "table_id": 1,
          "project_id": 1,
          "table_name": "users",
          "table_order": 0,
          "module_name": "Users",
          "table_view_title": "Users",
          "table_description": null,
          "show_quick_search": 1,
          "allow_pagination": 1,
          "pagination_type": "standard",
          "default_sort_by": null,
          "sort_descending": 0,
          "allow_csv_export": 1,
          "allow_csv_import": 1,
          "allow_print_view": 1,
          "allow_mass_delete": 1,
          "show_edit_button": 0,
          "show_delete_button": 0,
          "allow_restore_delete": 1,
          "allow_force_delete": 1,
          "tv_template": "horizontal",
          "hide_field_captions": 0,
          "use_first_field_as_title": 0,
          "table_view_classes_input": null,
          "detail_view_classes_input": null,
          "detail_view_title": "Detail View",
          "record_owner": "",
          "owner_fk_value": null,
          "default_focus": null,
          "redirect_after_insert": null,
          "enable_detail_view": 1,
          "delete_with_children": 0,
          "dv_allow_print_view": 1,
          "dv_separate_page": 0,
          "dv_hide_save_as_copy": 0,
          "dv_sticky_buttons": 1,
          "dv_allow_add_from_homepage": 0,
          "column_grid_type": "dynamic",
          "static_grid_columns": 2,
          "table_hook_workflow": null,
          "feature_source": null,
          "fields": {
            "id": {
              "field_id": 1,
              "table_id": 1,
              "field_name": "id",
              "field_order": 0,
              "caption": "ID",
              "description": null,
              "data_type": "BIGINT",
              "length": 20,
              "precision": null,
              "max_chars_in_tv": 50,
              "alignment": "left",
              "default_value": null,
              "read_only": 1,
              "primary_key": 1,
              "zero_fill": 0,
              "required": 0,
              "display_type": "text_input",
              "auto_increment": 1,
              "unique": 0,
              "is_indexed": 0,
              "show_sum": 0,
              "allow_sorting": 1,
              "tv_wrap_header": 0,
              "tv_wrap_text": 0,
              "tv_enable_toggle": 0,
              "tv_description_tooltips": 0,
              "tv_text_limit": 50,
              "tv_text_size": "Normal",
              "tv_font_weight": "Regular",
              "tv_date_time_format": "date_and_time",
              "tv_alignment": "left",
              "tv_text_color": null,
              "tv_icon": null,
              "tv_icon_color": null,
              "tv_currency_code": null,
              "unsigned": 1,
              "enable_global_filter": 1,
              "enable_individual_filter": 0,
              "enable_range_filter": 0,
              "binary": 0,
              "hide_in_tv": 1,
              "editable_in_tv": 0,
              "hide_in_dv": 0,
              "media_type": "link",
              "media_link_behavior": "detail_view",
              "media_link_display_as": "field_contents",
              "media_link_other_field": null,
              "allow_image_uploads": 0,
              "image_storage_provider": "local",
              "max_file_size": 250,
              "delete_image_server": 0,
              "dont_rename_image": 0,
              "tv_thumb_shape": "square",
              "tv_thumb_width": 50,
              "tv_thumb_height": 50,
              "tv_enable_zooming": 0,
              "tv_show_full_size": 0,
              "dv_thumb_shape": "square",
              "dv_thumb_width": 250,
              "dv_thumb_height": 250,
              "dv_enable_zooming": 0,
              "dv_show_full_size": 0,
              "allow_file_uploads": 0,
              "file_storage_provider": "local",
              "file_types": "images",
              "file_max_size": 1074,
              "delete_file_server": 0,
              "dont_rename_file": 0,
              "file_behavior": "download_link",
              "file_display_as": "clickable_icon",
              "file_other_field": null,
              "display_gmap": 0,
              "gmap_type": "url",
              "gmap_tv_width": 50,
              "gmap_tv_height": 50,
              "gmap_dv_height": 360,
              "accept_video_url": 0,
              "youtube_tv_width": 50,
              "youtube_tv_height": 50,
              "youtube_dv_width": 480,
              "youtube_dv_height": 360,
              "lookup_parent_table": null,
              "lookup_caption_1": null,
              "lookup_separator": null,
              "lookup_caption_2": null,
              "lookup_display_as": "dropdown",
              "lookup_inherit_permissions": 0,
              "lookup_link_behavior": "modal",
              "options_list_values": null,
              "options_display": "dropdown",
              "options_quick_list": null,
              "format_as": "default",
              "calculated_enable": 0,
              "calculated_query": null,
              "lookup_custom_query": null,
              "algorithm_enable": 0,
              "algorithm_logic": null,
              "calculation_builder_state": null,
              "hook_functions": null,
              "show_avg_summary": null,
              "show_count_summary": null,
              "show_range_summary": null,
              "format_mask": null,
              "helper_text": null,
              "placeholder": null,
              "min_length": null,
              "max_length": null,
              "min_value": null,
              "max_value": null,
              "off_autocomplete": "0",
              "column_span_full": 1,
              "lookup_searchable": 1,
              "lookup_preload": 1,
              "prefix": null,
              "suffix": null,
              "suffix_icon": null,
              "suffix_icon_color": null,
              "repeater_simple_display_as": null,
              "repeater_simple_format_as": null,
              "repeater_simple_list_values": null,
              "repeater_1_display_as": null,
              "repeater_1_format_as": null,
              "repeater_1_list_values": null,
              "repeater_2_display_as": null,
              "repeater_2_format_as": null,
              "repeater_2_list_values": null,
              "repeater_3_display_as": null,
              "repeater_3_format_as": null,
              "repeater_3_list_values": null,
              "repeater_simple_required": 0,
              "repeater_1_required": 0,
              "repeater_2_required": 0,
              "repeater_3_required": 0,
              "boolean_label_true": "Yes",
              "boolean_label_false": "No",
              "not_null": 0,
              "validations": []
            },
            "name": {
              "field_id": 2,
              "table_id": 1,
              "field_name": "name",
              "field_order": 1,
              "caption": "Name",
              "description": null,
              "data_type": "VARCHAR",
              "length": 255,
              "precision": null,
              "max_chars_in_tv": 50,
              "alignment": "left",
              "default_value": null,
              "read_only": 0,
              "primary_key": 0,
              "zero_fill": 0,
              "required": 1,
              "display_type": "text_input",
              "auto_increment": 0,
              "unique": 0,
              "is_indexed": 0,
              "show_sum": 0,
              "allow_sorting": 1,
              "tv_wrap_header": 0,
              "tv_wrap_text": 0,
              "tv_enable_toggle": 0,
              "tv_description_tooltips": 0,
              "tv_text_limit": 50,
              "tv_text_size": "Normal",
              "tv_font_weight": "Regular",
              "tv_date_time_format": "date_and_time",
              "tv_alignment": "left",
              "tv_text_color": null,
              "tv_icon": null,
              "tv_icon_color": null,
              "tv_currency_code": null,
              "unsigned": 0,